favorite_count,source,text,in_reply_to_screen_name,is_retweet,created_at,retweet_count,id_str714,Twitter for iPhone,"b'Based on the growing threat of the Coronavirus, sources say the IIHF/Hockey Canada is expected to announce today  t\xe2\x80\xa6 https://t.co/DFyxcFl451'",,False,Sat Mar 07 16:54:19 +0000 2020,308,b'1236334373055717377'
5304,Twitter Web App,"b""Check out some new costumes swinging into the alliance in MARVEL ULTIMATE ALLIANCE 3: The Black Order. Spider-Gwen'\xe2\x80\xa6 https://t.co/04UQX3plFm""",,False,Wed Jan 29 21:33:36 +0000 2020,757,b'1222633918504980480'
575,Twitter for iPhone,b'This is literally fake news. Anyone who bothers to read the letter can see that there is no threat. It\xe2\x80\x99s just notic\xe2\x80\xa6 https://t.co/p7gPg4i5MA',,False,Wed Jan 29 19:01:07 +0000 2020,242,b'1222595546558406656'
425,Twitter Web App,b'#RaiderNation \n\nShould the #Raiders re-sign the imminent unrestricted free agent DE Dion Jordan?\xe2\x80\xa6 https://t.co/9lEXHWT1Kk',,False,Mon Mar 09 18:00:13 +0000 2020,6,b'1237075736055427074'
11896,Twitter for iPhone,"b'As I\xe2\x80\x99ve said earlier tweet - Italy &amp; the US did a temporary country lockdown, not a local one. If checkpoints will\xe2\x80\xa6 https://t.co/X1QuAVAdSK'",,False,Thu Mar 12 15:39:55 +0000 2020,2402,b'1238127589807415296'
17164,Twitter for iPhone,"b'Two people in Senator @marcorubio\xe2\x80\x99s state have now died from the Coronavirus, but he is focused on being dramatic a\xe2\x80\xa6 https://t.co/aa53PV8vdb'",,False,Sat Mar 07 20:40:22 +0000 2020,3776,b'1236391260845293568'
1718,Twitter Web App,b'TOMORROW X TOGETHER\n\n- won ROTY in SMA\n- 11 Rookie of the Year\n- Magic Hour eligible for RIAJ Gold\n- 95k sales in O\xe2\x80\xa6 https://t.co/YEdIOPgYHt',,False,Fri Jan 31 10:59:57 +0000 2020,884,b'1223199233546711040'
2490,TweetDeck,b'Stop is 22 years old today \xf0\x9f\x8e\x82 Who could forget these iconic moves?! \nhttps://t.co/AsaO2x5ANV https://t.co/gOKMULqP7Z',,False,Mon Mar 09 08:00:00 +0000 2020,423,b'1236924684500905984'
778,Twitter for Android,b'Want to know the death rate in Italy from this outbreak?\n\n- 5%\n\nA whopping 5% of people tested positive for the cor\xe2\x80\xa6 https://t.co/EgNrY7OBAj',,False,Sun Mar 08 17:33:18 +0000 2020,300,b'1236706571452899332'
45796,Twitter Media Studio,b'Middleton crossed up Booker \xf0\x9f\x98\xb7 https://t.co/8HOVCtMoWd',,False,Sun Feb 02 20:56:26 +0000 2020,5985,b'1224074116614877185'
6560,SocialFlow,b'Bat Scientists Urge Colony To Reduce Spread Of Coronavirus By Sneezing Into Wing https://t.co/4MSmvKQnJU https://t.co/91r6LCARPl',,False,Fri Mar 06 21:44:08 +0000 2020,1260,b'1236044920718340098'
7005,Twitter Media Studio,"b'""Hey Drew!""\n\n@DrewBrees and @A_Kamara6 show off New Orleans in the @NFL\'s #NFL100 commercial! \n\n#Saints #SBLIV https://t.co/hgOo0BRDFN'",,False,Sun Feb 02 23:43:18 +0000 2020,1279,b'1224116112650047493'
1263,Twitter for iPad,"b'\xe2\x80\x9cIf Jared Kushner can\xe2\x80\x99t do it, it can\xe2\x80\x99t be done,\xe2\x80\x9d Trump said. Turns out that it can\xe2\x80\x99t be done if by \xe2\x80\x9cit\xe2\x80\x9d he meant r\xe2\x80\xa6 https://t.co/8ycUFam6dF'",,False,Tue Jan 28 23:17:43 +0000 2020,361,b'1222297734914310144'
1063,Twitter for iPhone,b'My reaction to the news\n\nIt Was All Worth It (??) https://t.co/IATPBfquxz',,False,Wed Jan 29 19:38:21 +0000 2020,50,b'1222604916851724288'
85642,Twitter for iPhone,b'If the Ladies in purple Decides to wear Blue they are Searching For Love And Rebirth so that means they take your s\xe2\x80\xa6 https://t.co/kSR6f1AjtF',,False,Wed Mar 04 02:42:42 +0000 2020,9342,b'1235032894088908800'
7375,Twitter for iPhone,"b'Buried in the article: Out of 3000 passengers, only 46 were tested.\n\n*Of them*, 21 were positive for coronavirus. https://t.co/LnpOPrz6Zj'",,False,Fri Mar 06 23:07:19 +0000 2020,4602,b'1236065856842428416'
2487,Twitter for iPhone,b'bruh i\xe2\x80\x99ve been working so hard i literally FORGOT MY BIRTHDAY WAS ON FRIDAY. like actually tho i forgot. i\xe2\x80\x99m usuall\xe2\x80\xa6 https://t.co/Kj8J8AQYxR',,False,Tue Mar 03 01:56:13 +0000 2020,110,b'1234658809378934784'
537,Twitter Web App,b'Air Canada to suspend all direct flights to Beijing and Shanghai effective tomorrow through end of February. Airlin\xe2\x80\xa6 https://t.co/7TmxLABfuA',,False,Wed Jan 29 20:01:41 +0000 2020,331,b'1222610785991561218'
335,Twitter for iPhone,"b'Dear friends. I am a bit confused and emotional, but it seems i have been saved. Please bear with me while I am pre\xe2\x80\xa6 https://t.co/Sr84j2qYTB'",,False,Wed Mar 04 18:49:05 +0000 2020,74,b'1235276094338732033'
14715,Twitter Media Studio,"b'""This is the most frightening disease I\'ve ever encountered in my career.""\n\nRichard Hatchett, the doctor leading ef\xe2\x80\xa6 https://t.co/8GLHJWez4n'",,False,Fri Mar 06 18:24:46 +0000 2020,10442,b'1235994748005085186'
10525,Twitter for iPhone,b'CPAC attendee tests positive for coronavirus https://t.co/HvqrwH1xxF',,False,Sat Mar 07 22:33:05 +0000 2020,3376,b'1236419625774186497'
2158,Twitter for iPhone,b'\xe2\x80\xbc\xef\xb8\x8f Coronavirus: Man in Japan tests positive again after recovering from illness.\n\n\xe2\x80\x9cLeading scientists also said the\xe2\x80\xa6 https://t.co/xqKxYQcQHf',,False,Mon Mar 16 12:59:29 +0000 2020,1415,b'1239536767121993731'
800,Twitter for iPhone,b'Presenting the artists that will hit the Open Decks in Mexico at #DejaVoom2020!\n\nspacegeishA\nGravitrax\nGrymeTyme\nSL\xe2\x80\xa6 https://t.co/dRNhFyTbth',,False,Thu Feb 27 23:32:45 +0000 2020,109,b'1233173150852055041'
25454,Twitter for Android,b'I feel so sorry for @republic TV reporters whom Arnab Goswami puts in such difficult situations. Still waiting for\xe2\x80\xa6 https://t.co/8DUzr3GJXF',,False,Tue Mar 03 10:27:49 +0000 2020,5362,b'1234787558313185280'
545,Twitter Web App,"b""TO CELEBRATE 555 FOLLOWERS!! \xf0\x9f\x8e\x89\nI'm hosting (my first ever, bear with me) raffle, because I love you all SO MUCH and\xe2\x80\xa6 https://t.co/QDmhw2K6pK""",,False,Sun Mar 08 23:44:19 +0000 2020,312,b'1236799943647678465'
265,Twitter for iPhone,b'@tedcruz How exactly would a #dumbfuckingwall prevent an #airborne virus from being transmitted.  It.  Literally.  Is.  In.  The.  Air.',tedcruz,False,Thu Feb 27 20:21:01 +0000 2020,13,b'1233124903207022593'
1872,Twitter for iPhone,b'White privilege is being able to walk around State Capitol buildings armed  &amp; looking like terrorists while black c\xe2\x80\xa6 https://t.co/gioTkXDPgR',,False,Sat Feb 01 17:50:29 +0000 2020,1041,b'1223664933717463040'
21289,Twitter for iPhone,"b'our beer league hockey team plays against \xe2\x80\x9cthe phantoms\xe2\x80\x9d 4 times every season. as the name suggests, the phantoms a\xe2\x80\xa6 https://t.co/OJVay6ybJY'",,False,Fri Jan 31 20:10:15 +0000 2020,1822,b'1223337720015048704'
48204,Twitter for iPhone,b'coronavirus hit italy hard because all the animated hand gestures fling the virus around',,False,Sat Mar 07 22:04:02 +0000 2020,3907,b'1236412315815284736'
1436,Twitter for Android,"b""Maybe it's the old in me but I don't know how to use Twitter yet. Thank you everyone for the messages. God bless you all.\n#UFC248""",,False,Sun Mar 08 21:36:46 +0000 2020,37,b'1236767842575343617'
233,SocialFlow,b'Pete Buttigieg has a new gig lined up this week: taking over late-night hosting duties for Jimmy Kimmel https://t.co/zTjFvWr3GY',,False,Mon Mar 09 14:04:06 +0000 2020,48,b'1237016314188890112'
1156,Twitter for iPhone,"b'Credit where credit due-@realDonaldTrump did EXCELLENT job at #Coronavirus press conference. Measured, patient (eve\xe2\x80\xa6 https://t.co/IpS0bTzqf6'",,False,Sat Feb 29 20:29:13 +0000 2020,270,b'1233851740107268098'
9747,Twitter for iPhone,b'Right out of the Trump playbook: https://t.co/EzEDX1YkFr',,False,Tue Jan 28 20:27:39 +0000 2020,3314,b'1222254935712108545'
354,Twitter for iPhone,"b'as a spidey stan, i feel really ecstatic that i have all the spider-man films on my netflix \xf0\x9f\x98\x8b https://t.co/SsLssdDL1e'",,False,Tue Jan 28 13:28:55 +0000 2020,23,b'1222149557011673089'
2162,Twitter Web App,"b'""When you\'re the father and your son\xe2\x80\x99s entire career is dependent on that, they own you"" \n\n- Donald Trump Jr, uniro\xe2\x80\xa6 https://t.co/SjQUg5xv9B'",,False,Tue Jan 28 22:58:44 +0000 2020,513,b'1222292956956299264'
5314,Twitter Web App,"b'Maya Moore put her career on hiatus to help 39-year-old Jonathan Irons get released from prison, and on Monday, Iro\xe2\x80\xa6 https://t.co/UWTJKIJBjL'",,False,Mon Mar 09 17:20:53 +0000 2020,1337,b'1237065834687856645'
172131,Twitter for iPhone,"b'Stormi\xe2\x80\x99s birthday is cool but,,,,y\xe2\x80\x99all see the resemblance too, right? https://t.co/LEEtAvsCUb'",,False,Sun Feb 02 01:37:39 +0000 2020,29271,b'1223782500188729352'
1649,TweetDeck,"b'Disney\'s official announcement of the HAMILTON film, which will star the original Broadway cast. They tout a ""live\xe2\x80\xa6 https://t.co/IRx94XxrpN'",,False,Mon Feb 03 17:07:37 +0000 2020,326,b'1224378922172854272'
1746,Twitter for iPhone,b'Statistically the most dangerous thing you can bring on an airplane is Lois Lane.',,False,Tue Feb 25 15:51:32 +0000 2020,261,b'1232332306704035840'
158,Twitter Web App,"b""Iranian ppl are furious over the coverup of the regime's incompetence in dealing with #Coronavid19 \nThey have distr\xe2\x80\xa6 https://t.co/XTQFUmLonM""",,False,Fri Feb 28 21:38:41 +0000 2020,107,b'1233506833198911492'
741,Chorus publishing platform,b'Trump\xe2\x80\x99s Israel-Palestine \xe2\x80\x9cpeace plan\xe2\x80\x9d is a con https://t.co/Qg8IkQnJwU',,False,Tue Jan 28 21:11:05 +0000 2020,217,b'1222265864931758080'
39,Twitter for iPhone,"b'If a person don\xe2\x80\x99t converse with ur public tweets or on other people\xe2\x80\x99s tweets, do u think it\xe2\x80\x99s creepy when u get a D\xe2\x80\xa6 https://t.co/ng2NG3nlDc'",,False,Tue Mar 03 03:23:49 +0000 2020,2,b'1234680853910847488'
1708,Twitter Web App,"b'Today PM @BorisJohnson visited Mologic Lab, to meet with scientists developing a home testing device for coronaviru\xe2\x80\xa6 https://t.co/QpWWtGeOzy'",,False,Fri Mar 06 14:30:33 +0000 2020,389,b'1235935804612112386'
3630,Twitter for iPhone,"b'\xe2\x80\x9cWhite pride\xe2\x80\x9d was carved on the ground outside a black-owned gym in Johnson City, Tenn. The local community rallied\xe2\x80\xa6 https://t.co/MZRIxt7JzH'",,False,Mon Mar 09 15:10:37 +0000 2020,1437,b'1237033052464754689'
1464,Twitter for iPhone,"b""Awfully strange that after three days of arguments from the President's defense, not even an attempt to defend the\xe2\x80\xa6 https://t.co/tuurkFvqou""",,False,Wed Jan 29 21:07:43 +0000 2020,365,b'1222627407284383746'
6052,Twitter for iPhone,b'How Does It Feel? \nBy D Savage \n\nOUT NOW!!!\n\nhttps://t.co/kBA7XpWXRb https://t.co/7UaRR5S8I7',,False,Sun Mar 01 22:42:13 +0000 2020,1908,b'1234247597839155200'
421,Twitter for iPhone,"b'All moved in, and now my desk feels cozy \xf0\x9f\xa5\xb0 https://t.co/etdCsylMoj'",,False,Wed Feb 26 14:57:25 +0000 2020,15,b'1232681074939043840'
2359,Twitter for iPhone,"b'I am a journalist, covering all manner of news and current affairs, and I confess I have absolutely no idea why you\xe2\x80\xa6 https://t.co/lQTyTKTMuq'",,False,Tue Mar 03 08:16:10 +0000 2020,204,b'1234754426897760257'
5173,Twitter for iPhone,b'Republican senators lament  \xe2\x80\x9cflawed process\xe2\x80\x9d and partisanship of Trump impeachment\n\nBut this moment isn\xe2\x80\x99t about pro\xe2\x80\xa6 https://t.co/dc1BNxoxTl',,False,Sat Feb 01 12:48:02 +0000 2020,1831,b'1223588820777566208'
1535,Twitter Web App,"b'Old Fox walks to the Post Office with his postal cards &amp; letters. He is sending them across Europe: Rouen, Winterbe\xe2\x80\xa6 https://t.co/shCIHUWhmy'",,False,Fri Jan 31 09:06:00 +0000 2020,289,b'1223170554343182337'
44950,Twitter for iPhone,b'I keep thinking about how 12 years ago Joe Biden and Sarah Palin were debating for Vice President. And now he\xe2\x80\x99s the\xe2\x80\xa6 https://t.co/U2hKOusGRR',,False,Fri Mar 13 01:49:23 +0000 2020,6321,b'1238280967778951175'
536,Twitter for iPhone,"b'""Today I spoke with the Internet Watch Foundation that investigated and confirmed over 100 cases of children being\xe2\x80\xa6 https://t.co/zz2zTJIFGX'",,False,Thu Feb 27 05:48:04 +0000 2020,373,b'1232905215709339648'
987,Twitter Web App,"b""Zhong Jinxing, 32, a doctor in Guangxi has died from 'overwork' after 33 consecutive days in virus 'control and pre\xe2\x80\xa6 https://t.co/CGSd08DUry""",,False,Sun Mar 01 05:50:25 +0000 2020,588,b'1233992973144051712'
428,TweetDeck,"b'KELLY: ""I think if there are people that could contribute to this, either innocence or guilt ... I think they shoul\xe2\x80\xa6 https://t.co/0HR1xs1iN9'",,False,Tue Jan 28 17:36:05 +0000 2020,164,b'1222211757210591237'
162,Twitter for Android,b'I was listening to BTS moans until they stop all of a sudden...it turns out that my mom started the car and my Bluetooth was connected....\xf0\x9f\x98\xad',,False,Sun Mar 08 00:01:46 +0000 2020,15,b'1236441945137766400'
10569,TweetDeck,"b'More than $65 million in charitable funds have been paid to Jay Sekulow, his wife, his sons, his brother, his siste\xe2\x80\xa6 https://t.co/LEt3b3lnPS'",,False,Sat Feb 01 14:00:00 +0000 2020,7721,b'1223606929974423552'
17907,Twitter for iPhone,b'YOUNG &amp; ALIVE \n\nMARCH 5th \n\ni\xe2\x80\x99m so excited for you to feel this one \n\nXx https://t.co/owGfOP2Ck7',,False,Tue Mar 03 21:24:21 +0000 2020,4119,b'1234952778381791233'
7022,Twitter for iPhone,b'Watch how his life was saved \xf0\x9f\x91\x8f https://t.co/4g0BIGEfEs',,False,Thu Feb 27 02:38:44 +0000 2020,3868,b'1232857567954472960'
17214,GoNintendo Tweeter,b'Japanese elementary school students host a virtual graduation in Minecraft while schools are closed due to coronavi\xe2\x80\xa6 https://t.co/QVImh98jTU',,False,Sun Mar 15 16:56:02 +0000 2020,4124,b'1239233910791438339'
273,Buffer,"b""To keep Genghis Khan's burial a secret, over 2000 people who attended his funeral were killed. After his tomb was c\xe2\x80\xa6 https://t.co/ioFbm5TwCe""",,False,Tue Mar 10 07:20:01 +0000 2020,164,b'1237277012143886336'
3227,Twitter for iPhone,b'10 PM for inter fan you can watch EP17 on LINETV\nLinks UWMA EP17 \xe0\xb8\x9a\xe0\xb8\x99 LINETV\nUWMA EP17 links for inter fans\n\n1/5\xe2\x80\xa6 https://t.co/WlLR3iT2SS',,False,Sun Mar 01 14:55:43 +0000 2020,2058,b'1234130202147487749'
706,Twitter for iPhone,"b'OMG! Poop Patrol chief arrested for alleged corruption \xf0\x9f\xa4\xa6\xe2\x80\x8d\xe2\x99\x80\xef\xb8\x8f\n\nHmm... he had a $312million budget, yet streets are st\xe2\x80\xa6 https://t.co/dVNoICYYoN'",,False,Wed Jan 29 15:46:08 +0000 2020,331,b'1222546475189665792'
25271,Twitter for iPhone,b'Very revealing to hear @BorisJohnson and then @NicolaSturgeon addressing the Coronavirus issue. She sounds concerne\xe2\x80\xa6 https://t.co/n5ROFftNtk',,False,Mon Mar 02 18:08:30 +0000 2020,3831,b'1234541103157825537'
2389,Sprout Social,b'\xf0\x9f\x8c\xb9\xf0\x9f\x8f\x88\xf0\x9f\x8c\xb9\xf0\x9f\x8f\x88\xf0\x9f\x8c\xb9 26 years ago tonight I co-headlined the #Superbowl XXVII Half Time Show at the Georgia Dome in Atlanta!! https://t.co/Gqf77diADX',,False,Mon Feb 03 00:14:47 +0000 2020,250,b'1224124032246861825'
7283,Twitter for iPhone,"b'Do your best to be especially kind to retail workers, from pharmacies to grocery stores and everything in between.\xe2\x80\xa6 https://t.co/pBA40djEmj'",,False,Fri Mar 13 01:33:16 +0000 2020,1548,b'1238276912671100930'
823,Twitter Web App,b'Trump on Pompeo berating NPR reporter for asking about Ukraine: \xe2\x80\x9cThat reporter couldn\xe2\x80\x99t have done too good a job on\xe2\x80\xa6 https://t.co/2ybe2wawbQ',,False,Tue Jan 28 17:33:00 +0000 2020,246,b'1222210981830504449'
2235,Twitter for iPhone,b'ok race is on for writing a corona v song I nominate myself https://t.co/JeC4BZTCbz',,False,Fri Mar 06 19:01:05 +0000 2020,525,b'1236003886961434626'
2465,Twitter for iPhone,b'BREAKING: The ACTU is calling on the Federal Government to urgently legislate for 2 weeks paid \xe2\x80\x9cspecial leave\xe2\x80\x9d for\xe2\x80\xa6 https://t.co/gRukyc3Ge8',,False,Wed Mar 11 01:06:34 +0000 2020,839,b'1237545417920802816'
5187,Twitter for iPhone,b'Matt Gaetz made light of coronavirus by wearing a gas mask. Now one of his constituents has died. https://t.co/K95EJn96GK',,False,Sat Mar 07 23:45:55 +0000 2020,2268,b'1236437955159310336'
15820,Twitter for iPhone,b'So now the President\xe2\x80\x99s Chief of Staff AND his natl security advisor (one of the more conservative people I have eve\xe2\x80\xa6 https://t.co/D4znMS5zpN',,False,Tue Jan 28 21:14:02 +0000 2020,4936,b'1222266605939245056'
1273,Twitter for iPhone,b'This is the CBS news truck getting towed from the Trump Rally. When you watch this clip what do you notice?\xe2\x80\xa6 https://t.co/q1slGcOYQ1',,False,Tue Jan 28 21:31:51 +0000 2020,788,b'1222271089755283456'
33724,Twitter for iPhone,b'Took in some @Stray_Kids for the afternoon. #Stay tuned to MTV News for something special \xf0\x9f\x96\xa4\xf0\x9f\x91\x80 #StrayKids #\xec\x8a\xa4\xed\x8a\xb8\xeb\xa0\x88\xec\x9d\xb4\xed\x82\xa4\xec\xa6\x88 https://t.co/nJlf7o6zyC',,False,Wed Jan 29 14:56:51 +0000 2020,8177,b'1222534073014542338'
3611,Twitter for iPhone,b'Those are not \xe2\x80\x9cgun rights activists.\xe2\x80\x9d\n\nThose are white supremacist terrorists. https://t.co/LKd0Ea28Sk',,False,Sun Feb 02 05:37:31 +0000 2020,917,b'1223842863827406848'
2476,Twitter for iPhone,"b'Joe Biden\xe2\x80\x99s victory has nothing to do with the establishment. \n\n\xe2\x80\x9cThis is why I love Nicole, tell the truth and sham\xe2\x80\xa6 https://t.co/nbIamQsJMV'",,False,Wed Mar 04 01:54:23 +0000 2020,793,b'1235020735632072705'
487,Twitter for iPhone,b'If the Corona virus removes a fair percentage of elderly UK residents before the end of 2020 (most of whom will hav\xe2\x80\xa6 https://t.co/rlS5lZ5OkO',,False,Thu Feb 27 10:38:26 +0000 2020,110,b'1232978291394596865'
678,Twitter for Android,"b""\xf0\x9f\x8e\xa8 Renjun's Birthday Giveaway \xf0\x9f\x8e\xa8\n\n\xf0\x9f\x9b\x8dRules :\n\xf0\x9f\x9b\x8dFollow me\n\xf0\x9f\x9b\x8dRT this tweet\n\xf0\x9f\x9b\x8dFav (like) this tweet\n\xf0\x9f\x9b\x8dDrop some Renjun pics \n\xf0\x9f\x9b\x8d\xe2\x80\xa6 https://t.co/BHs6zdG2Za""",,False,Sun Mar 08 14:52:11 +0000 2020,516,b'1236666027997564936'
44786,Twitter for iPhone,"b""Whew, y'all Joaquin Phoenix went so far in on #baftasowhite he walked away without his award.\n\nAlso, the best part\xe2\x80\xa6 https://t.co/E9z7CFAROz""",,False,Sun Feb 02 22:54:08 +0000 2020,11595,b'1224103738790465541'
42678,Twitter for iPhone,b'Dear @VP Pence: You need to resign from your coronavirus position with your shameful defense of shameful comments.\xe2\x80\xa6 https://t.co/ynnlKAuh4Q',,False,Sun Mar 01 16:22:55 +0000 2020,12595,b'1234152146611818497'
734,Twitter Web App,b'Delhi CM: Delhi has 3 positive cases and 1 suspected case of corona virus. The 1st patient came in contact with 105\xe2\x80\xa6 https://t.co/prYqJ51Gqv',,False,Sun Mar 08 07:57:38 +0000 2020,121,b'1236561701530513408'
77,Twitter for Android,"b""Thanks twatter for reminding me I'm old https://t.co/vQIKtvTUWE""",,False,Tue Mar 10 07:33:58 +0000 2020,2,b'1237280520427323392'
5451,Twitter Web App,"b'Good evening. Here is the news. \n\n""God save the Queen and Chelsea!""\n\n""ENGLAAAAAAAND!""\n\n""God save the Queen, fuck th\xe2\x80\xa6 https://t.co/YSy6HhxErZ'",,False,Sat Feb 01 00:11:37 +0000 2020,1683,b'1223398461233602566'
11547,Twitter for iPhone,b'a happy virus https://t.co/RH9u2sVVVp',,False,Wed Feb 26 06:11:13 +0000 2020,4653,b'1232548655053361152'
8809,Twitter Web App,"b'THOUSANDS in front of the US Capitol chanting, ""Hey, hey, ho, ho Donald Trump has GOT to GO!""\n\nThis is America.\xe2\x80\xa6 https://t.co/zAcZ8Fy5rL'",,False,Wed Jan 29 19:20:46 +0000 2020,3877,b'1222600489205891073'
16596,Hootsuite Inc.,b'We call on government communication agencies to prioritize public health interests in the light of a possible coron\xe2\x80\xa6 https://t.co/7VtMiJ0zrS',,False,Sun Mar 08 03:15:03 +0000 2020,3124,b'1236490588276523008'
545,Twitter for iPad,b'Reminder on #InternationalWomensDay israel shoots an innocent Palestinian 29yr-old woman multiple times\xe2\x80\xa6 https://t.co/bcnj3yvK4x',,False,Sun Mar 08 21:06:46 +0000 2020,845,b'1236760292174049280'
2298,Twitter for Android,b'Disability services notified last week of a \xe2\x82\xac20million cut to their budget with immediate effect. Meanwhile 18 reti\xe2\x80\xa6 https://t.co/dfQvUueht3',,False,Sat Jan 25 19:56:13 +0000 2020,766,b'1221159860777226248'
2294,Twitter Web Client,"b'Dr. Fauci said the nation cannot process coronavirus tests as quickly, easily or in the same volume as other countr\xe2\x80\xa6 https://t.co/gJatZR3NVi'",,False,Thu Mar 12 21:20:07 +0000 2020,1080,b'1238213202506375168'
652,Twitter for iPhone,"b'#IamEuropean having an EU Tribute evening as we appeoach this terrible deadline! French bread, Italian and Spanish\xe2\x80\xa6 https://t.co/90WGPOXYOy'",,False,Fri Jan 31 22:47:06 +0000 2020,54,b'1223377190156410886'
2025,Twitter for iPhone,b'Watch: More clips from @CBSNews exclusive with President Trump\xe2\x80\x99s choice to lead 17 intelligence agencies\xe2\x80\xa6 https://t.co/dLtMtvRglw',,False,Sun Mar 01 14:17:40 +0000 2020,698,b'1234120623858819072'
5091,Twitter for iPhone,"b'WATCH THE OFFICIAL TRAILER FOR  : THE FALCON AND THE WINTER SOLDIER, RIGHT NOW !!! \nSHARE THIS !! NOW!! \n\nDISNEY YO\xe2\x80\xa6 https://t.co/zdR6Z5GlOK'",,False,Sun Feb 02 21:24:05 +0000 2020,2074,b'1224081075988836352'
39928,Twitter for iPhone,b'I was hesitant on sharing my story but words can not express how happy I am. I feel like I officially closed a chap\xe2\x80\xa6 https://t.co/R81dYgxMPV',,False,Tue Mar 03 02:25:35 +0000 2020,3084,b'1234666200170291200'
3976,Twitter Web App,"b""President Trump doesn't just reject economists' warnings that he needs to act to avert recession\n\nhe told me today\xe2\x80\xa6 https://t.co/4sqYwhL801""",,False,Fri Mar 06 21:35:58 +0000 2020,2223,b'1236042866826383360'
1235,Twitter for iPhone,b'Labour\xe2\x80\x99s official report into worst electoral defeat for 80 years - written by Ian Lavery and Andrew Gwynne - has e\xe2\x80\xa6 https://t.co/nsxnciAlWM',,False,Wed Jan 29 07:36:32 +0000 2020,605,b'1222423266045911040'
2079,Twitter for Android,b'Protest puppies https://t.co/9qdSrnBUcw',,False,Mon Mar 02 00:07:01 +0000 2020,376,b'1234268940508942336'
5950,Twitter for iPhone,b'So let me get this straight: Trump admin officials greeted the Coronavirus evacuees from China at Travis AFB withou\xe2\x80\xa6 https://t.co/mOzCNt26E7',,False,Fri Feb 28 03:12:26 +0000 2020,2537,b'1233228439630630912'
18403,Twitter Media Studio,"b'""I\'m so ugly.""\n\nPeople are rallying around this 4-year-old Black girl after a video of her calling herself ugly wen\xe2\x80\xa6 https://t.co/zW7Uctasla'",,False,Tue Mar 10 20:45:02 +0000 2020,9964,b'1237479599195463682'
273,Twitter Web App,"b""There's some Chinese social media posts basically announcing:\n\n1. New railways and trains:\n2. Most of the snow bein\xe2\x80\xa6 https://t.co/NasZfVTRQ8""",,False,Mon Mar 02 10:29:06 +0000 2020,53,b'1234425494155587584'
1137,Twitter for Android,b'British Airways landing at NMIA last Wednesday. I was scared out of my wits. I thought the 777 broke in two. Hardes\xe2\x80\xa6 https://t.co/LPC4R4yrJL',,False,Sun Mar 08 21:57:40 +0000 2020,230,b'1236773103478411264'
8234,Twitter for Android,b'#LALISA (Teaser)\nA Documentary Film \xf0\x9f\x8e\xa5\n03.27.2020 \n\n#LISA #BLACKPINK\n@ygofficialblink https://t.co/evOFHkGewb',,False,Mon Feb 03 04:07:04 +0000 2020,4437,b'1224182489544921089'
2314,Twitter Web App,"b""I'm down to 5 cigarettes. I gotta get out of the place that I came to get out of a place. \n\nLast election, I voted\xe2\x80\xa6 https://t.co/xq9fqJAQpp""",,False,Thu Jan 30 02:00:57 +0000 2020,328,b'1222701199100649473'
66,Twitter for iPhone,b'Bernie\xe2\x80\x99s record has escaped the close scrutiny other candidates have received. \n\nBut don\xe2\x80\x99t believe for a minute tha\xe2\x80\xa6 https://t.co/48nr2Tb1zE',,False,Tue Jan 28 23:27:35 +0000 2020,25,b'1222300214394007558'
23582,Twitter for iPhone,"b'After listening to the Dems\xe2\x80\x99 20+ hours of argument and the rebuttal arguments from @realDonaldTrump, I\xe2\x80\x99ve got lots\xe2\x80\xa6 https://t.co/dCs0BIZevM'",,False,Tue Jan 28 19:33:23 +0000 2020,5287,b'1222241277800013825'
12430,Twitter for iPhone,"b'Fake news Ted Cruz, makes up something that can\xe2\x80\x99t be made up. Lev Parnas\xe2\x80\x99 attorneys attended the trial, while Lev j\xe2\x80\xa6 https://t.co/hUrAkx0oVw'",,False,Wed Jan 29 21:45:26 +0000 2020,4464,b'1222636896632954882'
1194,Twitter for iPad,"b'#qanda Stan Grant is right. This land was stolen, and our response to Corona virus shows we are still racist'",,False,Mon Feb 24 11:24:35 +0000 2020,201,b'1231902738205667328'
156,TweetDeck,"b'TV star Scott Cam has defended his $350,000 government ambassador position after it was revealed he had already poc\xe2\x80\xa6 https://t.co/32gt5Athdp'",,False,Mon Mar 09 23:40:44 +0000 2020,89,b'1237161428512993280'
3065,Twitter Web App,b'How many more gunmen need to fire shots in the air before Hindutva is officially categorised as a terrorist ideology?',,False,Sat Feb 01 12:13:38 +0000 2020,803,b'1223580162144395266'
94982,Twitter Web App,"b'We had weeks of warning. Weeks to prepare. Excuse my language, but this is completely unacceptable. Where the hell\xe2\x80\xa6 https://t.co/Bn7wHyMg2i'",,False,Fri Mar 06 16:38:40 +0000 2020,19898,b'1235968047950614529'
