favorite_count,source,text,in_reply_to_screen_name,is_retweet,created_at,retweet_count,id_str20246,Twitter for iPhone,b'Coronavirus is a government made disease like Ebola',,False,Sat Mar 07 13:59:47 +0000 2020,5172,b'1236290450404839424'
4520,Twitter Media Studio - LiveCut,"b'""I became a face of compassion, of redemption, of grace, and of second chances, because that is what this country h\xe2\x80\xa6 https://t.co/cvleAAlzcO'",,False,Sat Feb 29 18:02:18 +0000 2020,1255,b'1233814768127008771'
10334,Twitter for iPhone,b'Thought for Sunday: 34 people affected by corona virus so far in India; 53 people killed by communal virus in Delhi\xe2\x80\xa6 https://t.co/FTLTbeHUZu',,False,Sun Mar 08 03:52:33 +0000 2020,2261,b'1236500023350886400'
4036,Twitter Web App,b'Mexican beer rebrands as Ebola to avoid association with coronavirus #coronaravirus https://t.co/jsjvy9tcEX',,False,Wed Jan 29 09:42:12 +0000 2020,820,b'1222454887746887680'
3902,Twitter Web App,"b'Bolton is correct saying Trump is ""mentally unstable."" What he sees is Trump\'s very obvious deterioration:\n-He has\xe2\x80\xa6 https://t.co/Ce4JYhRHP2'",,False,Tue Jan 28 23:11:54 +0000 2020,1650,b'1222296267541417985'
29976,Twitter for iPhone,b'#MONBEBE thank you for all of your support during our US promo week. We love you #AllAboutLuv\xe2\x80\xa6 https://t.co/mmm59eNTga',,False,Wed Mar 04 01:00:18 +0000 2020,6452,b'1235007123303497728'
408,Twitter for iPhone,"b'Doesn\xe2\x80\x99t feel real, but I\xe2\x80\x99m happy to announce I\xe2\x80\x99m represented by @qnrisawesome!\n\nAt 12 I wrote to cope w/ cancer dia\xe2\x80\xa6 https://t.co/Y2YXrQ7HoH'",,False,Fri Feb 28 21:01:24 +0000 2020,14,b'1233497451509796864'
5311,Twitter Web Client,b'Matt Gaetz made light of coronavirus by wearing a gas mask. Now one of his constituents has died. https://t.co/iqihtaFhCt',,False,Sat Mar 07 19:42:53 +0000 2020,2580,b'1236376797446578176'
1298,Twitter for Android,"b""Something sinister is coming to #MarvelFutureFight However, we're confident our Agents are capable of adapting to t\xe2\x80\xa6 https://t.co/IuZHioDlB3""",,False,Mon Mar 09 04:28:39 +0000 2020,180,b'1236871498784096258'
3302,Twitter for iPhone,"b""Republicans unleashed the world's hottest economy by cutting taxes\xe2\x80\x94not raising them.\n\nBut Dems don't even try to hi\xe2\x80\xa6 https://t.co/nskS3LN3s6""",,False,Sat Feb 29 20:52:22 +0000 2020,1013,b'1233857568176582657'
416,Emplifi,"b'Last month you were selfless, this month you were strapped. Now it\xe2\x80\x99s time for a treat. We\xe2\x80\x99re giving five lucky winn\xe2\x80\xa6 https://t.co/nJ8Z1F7pob'",,False,Fri Jan 31 09:11:01 +0000 2020,413,b'1223171816828465153'
524,Twitter for Android,b'Bagged First place NYSC #Benue State awards!!!\n\n Dedicated to God and to you all fam\n\nI hope this inspires more Cor\xe2\x80\xa6 https://t.co/IBaPs3ruB9',,False,Fri Mar 13 05:41:48 +0000 2020,77,b'1238339458971418624'
397,TweetDeck,"b'U.S. president Donald Trump has unveiled details of his administration\'s Middle East peace plan including ""a realis\xe2\x80\xa6 https://t.co/Q9PZXAVW2R'",,False,Tue Jan 28 17:31:31 +0000 2020,157,b'1222210611255435264'
1812,Twitter for iPhone,"b'That S.Korea has already tested 140,000 people while we, with a test kit shortage, have tested only 1900 is the res\xe2\x80\xa6 https://t.co/KBxNTHrjV4'",,False,Sat Mar 07 01:06:54 +0000 2020,974,b'1236095949170241541'
6801,Twitter for Android,b'A Mamma Bear with her Cubs\xf0\x9f\x90\xbc\xf0\x9f\x90\xbe\xf0\x9f\x90\xbe\xf0\x9f\x90\xbe\xf0\x9f\x90\xbe\xf0\x9f\x90\xbe\xf0\x9f\x90\xbe\xf0\x9f\x98\x98\n\nIt\xe2\x80\x99s not the bear that\xe2\x80\x99s crossing the road. It\xe2\x80\x99s the road that\xe2\x80\x99s crossing the f\xe2\x80\xa6 https://t.co/4xr4E4Qebc',,False,Fri Mar 13 00:36:06 +0000 2020,2284,b'1238262523905953792'
23478,Twitter for iPhone,b'Y\xe2\x80\x99all. YALL. The test don\xe2\x80\x99t even work. \n\nThe US declined to use the WHO\xe2\x80\x99s virus test (that actually works) that oth\xe2\x80\xa6 https://t.co/bCbEvaVeOp',QueeringPsych,False,Sat Feb 29 16:47:34 +0000 2020,3977,b'1233795960419094528'
582,Twitter for Android,"b'Energy, love, passion, patriotism, @realDonaldTrump rallies will positively change your life! Still two hours to go\xe2\x80\xa6 https://t.co/NwjxK7K4ek'",,False,Tue Jan 28 23:02:34 +0000 2020,174,b'1222293918894764032'
358,Twitter for iPhone,b'As seen in western NY: https://t.co/tFTf6t38Pg',,False,Wed Feb 26 23:03:35 +0000 2020,104,b'1232803425160704000'
72,Twitter Web App,b'Horse slaughterhouse workers exposed for beating former racehorses with pipes \n\nhttps://t.co/t2IJ1aEbg7',,False,Thu Mar 05 19:00:16 +0000 2020,151,b'1235641297005711360'
4699,Twitter for Android,b'To those who now have 28 packets of pasta. Those searching the black market for hand sanitizer. To those walking ar\xe2\x80\xa6 https://t.co/1ofoYhrzH0',,False,Sun Mar 08 13:59:50 +0000 2020,1689,b'1236652852724056069'
113,Twitter for Android,b'How many ults do you guys have? I feel like I have more then most people.\n\nhttps://t.co/iqgeYjFv4B',,False,Tue Mar 03 21:09:05 +0000 2020,4,b'1234948937028710403'
2627,Twitter Web App,"b'I always feel compelled to show love to demonized species. \n\nMeet the Satanic Leaf-tailed Gecko, a small lizard fro\xe2\x80\xa6 https://t.co/WDYTusmPUw'",,False,Tue Mar 03 20:09:51 +0000 2020,372,b'1234934030992363522'
7766,Twitter Web App,"b'The Romantic Adventures of Gobbarian the Tsundere and the Orcward Fighter \xf0\x9f\x98\x8a\n\nMore art block-busting art, now featur\xe2\x80\xa6 https://t.co/X2xY9Zb1Fm'",,False,Fri Mar 06 16:06:25 +0000 2020,1372,b'1235959933067071488'
426,Twitter Web App,"b'Natasha White, a 34-yr-old university worker, killed herself after sometimes spending her entire salary on gambling\xe2\x80\xa6 https://t.co/ck1u0bXYvJ'",,False,Mon Mar 09 09:09:14 +0000 2020,123,b'1236942109078413314'
2177,Twitter for iPhone,"b'I\xe2\x80\x99ll be on @FoxFriendsFirst at 5am, @democracynow around 8:20am and then @HillTVLive with @krystalball and @esaagar\xe2\x80\xa6 https://t.co/bx4KanWDQa'",,False,Wed Mar 04 09:05:41 +0000 2020,322,b'1235129274375565312'
2560,Twitter for Android,"b""Sinfin, Derby. Yes Sir, thank you for pointing out your foot is trapped. It's trapped because you and your mate wer\xe2\x80\xa6 https://t.co/TCN7CFwGKd""",,False,Sat Mar 07 19:39:35 +0000 2020,213,b'1236375964029943809'
5541,Twitter for iPhone,b'How Jimmy G practicing handoffs for the Super Bowl https://t.co/fC7emZCb8v',,False,Sun Feb 02 22:50:37 +0000 2020,1232,b'1224102852773040128'
127,Twitter for iPhone,b'If you haven\xe2\x80\x99t listened to the Watch What Crappens podcast\xe2\x80\x99s recap of this weeks #PumpRules then you have to do it.\xe2\x80\xa6 https://t.co/3VJyyhXddq',,False,Sun Feb 23 18:03:16 +0000 2020,5,b'1231640683720691712'
4492,Twitter for Android,b'By far the most interesting candidate whose momentum no one saw coming this election cycle has been @AndrewYang. Hi\xe2\x80\xa6 https://t.co/TlMjzZDh86',,False,Wed Jan 29 01:13:34 +0000 2020,799,b'1222326889987084288'
563,Twitter Web App,"b'HEY TTRPG COMMUNITY!\nWith so many cons being cancelled due to COVID19, we are looking to collaborate with other Twi\xe2\x80\xa6 https://t.co/9V3Me9VSC3'",,False,Sat Mar 14 14:39:36 +0000 2020,349,b'1238837188349038592'
1912,Twitter for iPad,b'The one previous crisis not of Trump\xe2\x80\x99s making was Hurricane Mar\xc3\xada. The administration response was horribly botched\xe2\x80\xa6 https://t.co/1R7FtDuWG2',,False,Sat Mar 07 22:43:05 +0000 2020,656,b'1236422143040200708'
182,Twitter for iPhone,"b'While I get it , this feels wrong in many ways #QConLondon https://t.co/r9zGlCzzDM'",,False,Mon Mar 02 14:48:50 +0000 2020,18,b'1234490855978917890'
2412,Twitter for iPhone,"b'no one:\n\nstrategists: our modern world is more DIVIDED than ever, the more CONNECTED we are the more DISCONNECTED w\xe2\x80\xa6 https://t.co/23qLRFfq1a'",,False,Fri Mar 06 17:37:19 +0000 2020,292,b'1235982807018532865'
4453,Twitter for iPhone,b'Rep. Matt Gaetz made light of coronavirus by wearing a gas mask. Now one of his constituents has died. https://t.co/IZFeChSk3W',,False,Sun Mar 08 00:08:52 +0000 2020,2010,b'1236443731412299778'
4368,TweetDeck,b'OUTRAGEOUS: Senate Republicans just blocked an emergency bill to provide paid sick leave to workers impacted by the\xe2\x80\xa6 https://t.co/PNbFaop60O',,False,Wed Mar 11 18:46:07 +0000 2020,3803,b'1237812059980673024'
3022,Twitter for iPhone,"b""It's an argument for autocracy. By Dershowitz's logic, a month before the election couldn't Trump, viewing his re-e\xe2\x80\xa6 https://t.co/PZ5zN5i7md""",,False,Thu Jan 30 01:06:21 +0000 2020,1177,b'1222687459781357569'
4341,Twitter Web App,b'Great News for Julian Assange\n\nThe Parliamentary Assembly of the Council of Europe (PACE) is demanding the immediat\xe2\x80\xa6 https://t.co/l11Edzx2V9',,False,Thu Jan 30 05:54:27 +0000 2020,1837,b'1222759962864050176'
4782,Twitter for iPhone,"b'The day after the Robert Mueller testimony, Trump had his call with Zelensky. What does he do the day after a senat\xe2\x80\xa6 https://t.co/FBrn52CAz5'",,False,Fri Jan 31 13:42:05 +0000 2020,1622,b'1223240033626476547'
1909,Twitter Web App,"b""Before this gets off the bad faith rails any further, at tonight's #DemDebate, @PeteButtigieg was being critical of\xe2\x80\xa6 https://t.co/ZfRxn61jdG""",,False,Wed Feb 26 04:10:42 +0000 2020,536,b'1232518326842163207'
1482,Twitter for iPhone,b'COVID-19 Advice!\n Remember to cover your nose &amp; mouth when coughing or sneezing with a cloth or in your flexed elbo\xe2\x80\xa6 https://t.co/V40yT4oNlJ',,False,Fri Feb 28 07:55:08 +0000 2020,871,b'1233299582408327168'
995,Twitter for iPhone,b'The beginning of the #GreenBeanQueen\xf0\x9f\x91\x91 snow adventure today \xf0\x9f\x98\x8a\n\nIt\xe2\x80\x99s hard to get in front of her now to film her. \n\nN\xe2\x80\xa6 https://t.co/CucGujrPL7',,False,Thu Jan 30 00:06:50 +0000 2020,79,b'1222672480436981767'
1184,Twitter for iPhone,b'#BrexitReality \nThe Galileo satellite system was a good example of where pooling resources at #European level saved\xe2\x80\xa6 https://t.co/NeixoqswR5',,False,Wed Mar 04 07:25:38 +0000 2020,738,b'1235104096828325888'
827,Twitter Web App,"b'Florida ""Assault Weapon"" ban comes 80% SHORT of enough signatures to put it on the ballot.  https://t.co/mtJzb59sBd'",,False,Sun Feb 02 22:06:15 +0000 2020,191,b'1224091687493959682'
1650,Twitter for iPhone,"b'The coronavirus tests are perfect, \xe2\x81\xa6@realDonaldTrump\xe2\x81\xa9 says, just like his call with Ukraine that led to his impeach\xe2\x80\xa6 https://t.co/dfqUC0YIT2'",,False,Fri Mar 06 22:18:23 +0000 2020,437,b'1236053541090975745'
14278,Twitter for iPhone,"b'ARMY, have you checked out the #EgoChallenge yet on TikTok? Why not join to help promote the song and also have som\xe2\x80\xa6 https://t.co/QZ3hhBJQwI'",,False,Sun Feb 02 21:12:45 +0000 2020,5142,b'1224078223090356226'
4585,Twitter for iPhone,b'Sekulow says Trump is being impeached for \xe2\x80\x9cpolicy disagreements.\xe2\x80\x9d Is it governmental policy to unlawfully withhold\xe2\x80\xa6 https://t.co/ly4djYVSQM',,False,Tue Jan 28 21:00:45 +0000 2020,1495,b'1222263262781243392'
835,Twitter for Android,b'Terrorist cosplay is a bizzare hobby. https://t.co/JqPTl0KQs0',,False,Sun Feb 02 03:58:18 +0000 2020,141,b'1223817896012333061'
1154,Twitter Web App,"b'in California, there are likely several thousand people who have been exposed to COVID-19. but only 516 people have\xe2\x80\xa6 https://t.co/qG8dVeiMvM'",,False,Fri Mar 06 16:32:10 +0000 2020,952,b'1235966410897018880'
644,Twitter Web App,b'Why would #CoronaKatie and the Governor of Oklahoma both post virus-truther photos of themselves on the same night?\xe2\x80\xa6 https://t.co/4qBlG7rKt6',,False,Sun Mar 15 03:10:22 +0000 2020,155,b'1239026123498905601'
411,Twitter Web App,b'One person connected to #UDel has tested positive for Coronavirus. The individual is receiving medical care in a qu\xe2\x80\xa6 https://t.co/kxOHKDuqNe',,False,Wed Mar 11 20:26:49 +0000 2020,412,b'1237837402816663552'
2783,Twitter for iPhone,"b'Not a good sign, and the opposite of an endorsement: The ambassadors of Egypt and Jordan, the only two Arab countri\xe2\x80\xa6 https://t.co/Kt0pl3TNFD'",,False,Tue Jan 28 19:16:39 +0000 2020,1213,b'1222237065993228294'
530,Twitter for iPad,b'The Islamic Regime has plunders Iran\xe2\x80\x99s wealth in expanding terrorism in the region failing its citizens for 41 year\xe2\x80\xa6 https://t.co/dh9M5f65YS',,False,Sat Mar 07 15:51:34 +0000 2020,297,b'1236318583984193536'
63,Twitter for iPhone,b'The Govt\xe2\x80\x99s approach to Coronavirus this week has fallen \xe2\x80\x9cwoefully\xe2\x80\x9d short. https://t.co/kGXHqyfaBm',,False,Fri Mar 06 19:19:10 +0000 2020,4,b'1236008438796181504'
3386,Twitter Web App,b'BREAKING: Sky Sports News are reporting that Everton have rejected an \xc2\xa385m bid from Barcelona for Richarlison. \n\nF*\xe2\x80\xa6 https://t.co/oXt8hK2dzR',,False,Wed Jan 29 17:03:30 +0000 2020,317,b'1222565946218467329'
6823,Twitter for iPhone,b'I feel deeply honored! https://t.co/EpPO74A0j1',,False,Sat Feb 29 11:10:45 +0000 2020,1193,b'1233711199260495872'
9732,Twitter Web App,"b""If you feel sad just remember Yoongi's words \xf0\x9f\xa5\xba https://t.co/46MHJwD2FH""",,False,Tue Mar 03 21:02:56 +0000 2020,4330,b'1234947387493421056'
7160,Twitter Web App,"b'Double standards aside, the coronavirus is not a joke and the thousands of deaths worldwide are not to be taken lig\xe2\x80\xa6 https://t.co/OwRyAkYc94'",RepBobbyRush,False,Fri Mar 06 16:01:59 +0000 2020,1200,b'1235958817009160192'
2210,SmarterQueue,"b""NEWS: Nintendo Lawsuit Takes Mario Kart off Japan's Roads\n\n\xe2\x9c\xa8 More: https://t.co/xx2U36irOF https://t.co/tX0aw7YZpx""",,False,Thu Jan 30 23:30:19 +0000 2020,345,b'1223025681942163459'
3400,Twitter for iPhone,b'@MrPeanut may be a baby now but he has some words of wisdom for us all. \n\nWelcome Back! #BabyNut #Ad https://t.co/ZvHmZx7C0v',MrPeanut,False,Mon Feb 03 00:51:23 +0000 2020,818,b'1224133245295419392'
539,Twitter for iPhone,"b'McKenzie asked Sport Aust to consider 9 new/amended applications after closing date, 2 months before May election.\xe2\x80\xa6 https://t.co/P0stWGc18l'",,False,Fri Jan 24 21:39:55 +0000 2020,300,b'1220823568767807488'
2641,Twitter for iPhone,b'Trump just admitted he is endangering American lives on purpose so that he can deceive the country about the number\xe2\x80\xa6 https://t.co/WFyDcSPc7y',,False,Sat Mar 07 18:03:41 +0000 2020,982,b'1236351832533983233'
2511,Twitter for Android,"b'@PhilipWegmann I was told coronavirus was a ""hoax"" perpetuated by Democrats https://t.co/shK2SRps80'",PhilipWegmann,False,Sat Mar 07 22:18:49 +0000 2020,128,b'1236416037211508736'
1130,Twitter Web Client,b'The White House overruled health officials who wanted to recommend that elderly and physically fragile Americans be\xe2\x80\xa6 https://t.co/CHN1TJXCsd',,False,Sun Mar 08 03:00:08 +0000 2020,919,b'1236486832491237376'
907,Twitter Web Client,"b""Strap yourself in. Hands up.\n\nTrump spent 3 years at the top of the roller coaster created by Obama. Now we're abou\xe2\x80\xa6 https://t.co/WIqR5lCjEa""",,False,Mon Mar 09 10:55:37 +0000 2020,289,b'1236968880691650562'
16862,Twitter for iPhone,b'Lamar Alexander: Trump\xe2\x80\x99s misbehavior \xe2\x80\x9cundermines the principle of equal justice under the law.\xe2\x80\x9d But it\xe2\x80\x99s up to the\xe2\x80\xa6 https://t.co/mjbwpE1oQy',,False,Sat Feb 01 15:04:08 +0000 2020,4378,b'1223623070876950535'
2854,Twitter Web App,"b'In last *24 hours*\n\n1,000+ coronavirus cases in US\nWHO declares ""pandemic""\nDow enters bear market\nItaly closes biz\xe2\x80\xa6 https://t.co/UotuqHT7zz'",,False,Thu Mar 12 02:05:06 +0000 2020,1239,b'1237922534936514561'
2148,Twitter for iPhone,b'Meet Fatemeh Rahbar member of parliament in Iran who has died today from #coronavirus. She was against freedom of c\xe2\x80\xa6 https://t.co/gsIrDzKQ7i',,False,Sat Mar 07 09:48:20 +0000 2020,582,b'1236227172370731008'
16288,Twitter for iPhone,"b'\xf0\x9f\xa4\xb7\xe2\x80\x8d\xe2\x99\x82\xef\xb8\x8f Sure, connect four is cool but we\xe2\x80\x99ve got a better idea!\n\nWe need 63 other teams to enter a knock-out FIFA 20 t\xe2\x80\xa6 https://t.co/q1CWBJYnu9'",,False,Sun Mar 15 19:46:58 +0000 2020,3398,b'1239276927573262341'
1744,Twitter for iPhone,b'This is my niece who recently qualified as a pilot only to lose her job with FlyBe going bust. Any jobs for a young\xe2\x80\xa6 https://t.co/oKp5A7NH39',,False,Thu Mar 05 08:44:38 +0000 2020,411,b'1235486363862142976'
372,SocialFlow,b'New York Attorney General Letitia James said that her office is on alert for coronavirus scams like Bakker\xe2\x80\x99s. https://t.co/weau79mJQC',,False,Sun Mar 08 00:02:39 +0000 2020,131,b'1236442166613942273'
4819,Twitter for iPad,b'Deeply conflicted on the Arnab @kunalkamra88 incident.\nMind says - Why stoop so low?\nHeart says - But finally Arnab\xe2\x80\xa6 https://t.co/TxHh4DJ7xJ',,False,Wed Jan 29 02:12:44 +0000 2020,861,b'1222341776163237888'
38156,Twitter for iPad,b'My mom works almost 24/7 because of COVID-19. I hope we all appreciate our health workers\xe2\x80\x99 sacrifices to keep all o\xe2\x80\xa6 https://t.co/iUUbtzzcxL',,False,Wed Mar 11 16:41:17 +0000 2020,5262,b'1237780646572908545'
230,Twitter Web Client,"b'VERY STABLE GENIUS: \xe2\x80\x9cPeople are really surprised I understand this stuff,\xe2\x80\x9d Trump said. \xe2\x80\x9cEvery one of these doctors\xe2\x80\xa6 https://t.co/bYGX3W5G63'",,False,Sat Mar 07 02:34:55 +0000 2020,92,b'1236118098119405568'
39432,SocialFlow,b'BREAKING: The White House overruled health officials who wanted to recommend that elderly and physically fragile Am\xe2\x80\xa6 https://t.co/ISbh2YX3vV',,False,Sun Mar 08 02:18:54 +0000 2020,25645,b'1236476457494417408'
790,Twitter Media Studio,"b""Students beaten up. \nMore than 30 dead. \nOver 1000 arrested. \nAnd 500 detained. \n\nDefend India's right to peacefull\xe2\x80\xa6 https://t.co/4F5w9hxgYS""",,False,Sun Mar 01 01:35:00 +0000 2020,573,b'1233928692503461888'
2224,Twitter Web App,"b""The 7000 caring Americans who don't have to be 'noodged' to vote for Joe Biden have warmed the cockles of an almost\xe2\x80\xa6 https://t.co/uo8YsTIrRq""",,False,Mon Mar 09 02:27:10 +0000 2020,139,b'1236840923624902656'
499,Twitter Web App,b'That is not what they found at all. They reported that SARS &amp; MERS (cousin viruses) can get into the central nervou\xe2\x80\xa6 https://t.co/OA3BVFkdFR',,False,Mon Mar 02 21:12:34 +0000 2020,134,b'1234587425495814147'
26950,Twitter for iPhone,"b'Today is a day, among many, that I pray someone is following the money. To Giuliani, to the Trump business, to Jared\xe2\x80\x99s business. All of it.'",,False,Tue Jan 28 20:28:01 +0000 2020,5380,b'1222255027194155008'
4321,Twitter Web App,"b'Those who damage public/private property in the name of protest, procession, agitation will have to compensate. The\xe2\x80\xa6 https://t.co/jGp8cR2zdF'",,False,Tue Mar 03 11:55:19 +0000 2020,932,b'1234809575280238592'
3845,Twitter for iPhone,"b'If you have been panic buying because of Coronavirus and have found that your shop has run out of toilet paper, ple\xe2\x80\xa6 https://t.co/BvKVCn5WyM'",,False,Sat Mar 07 12:26:49 +0000 2020,748,b'1236267055592202242'
145,Twitter for iPhone,"b'Used in the weedkiller, which is sprayed on oats before harvest as a drying agent, classified as ""probably carcinog\xe2\x80\xa6 https://t.co/2SxtKtgxv9'",,False,Fri Mar 06 07:19:19 +0000 2020,80,b'1235827282607869953'
651,TweetDeck,"b'Novel coronavirus cases continue to climb, but Canada\xe2\x80\x99s response has been \xe2\x80\x9cexemplary\xe2\x80\x9d when it comes to containing t\xe2\x80\xa6 https://t.co/VX0v4zQSW6'",,False,Sat Mar 07 14:00:00 +0000 2020,397,b'1236290505086046208'
1970,Twitter for iPhone,b'Coronavirus - My current position is that we waited far too long to contain it / quarantine. All of us have already\xe2\x80\xa6 https://t.co/DFAdNNN4AB',,False,Tue Mar 03 00:49:17 +0000 2020,250,b'1234641964735156225'
4395,Twitter for iPhone,b'Trump compared the Coronavirus test to the transcript of his phone call with Zelensky: \xe2\x80\x9cthe tests are all perfect.\xe2\x80\xa6 https://t.co/ZH3pHcq2XQ',,False,Fri Mar 06 22:35:59 +0000 2020,1440,b'1236057970477355009'
29872,Twitter for iPhone,"b""DAY6 WORLD TOUR 'GRAVITY'\n\xf0\x9f\x93\x8dMADRID 2020.01.31\n\nAmazing Madrid\xf0\x9f\xa4\xa9\nThanks to My Day, we made it to our final stop in Eur\xe2\x80\xa6 https://t.co/7Yk2eTs1wN""",,False,Sat Feb 01 01:06:13 +0000 2020,8226,b'1223412202108882944'
502,Twitter Media Studio,"b""Didn't get a chance to watch the all-new episode of #TheRookie? Watch NOW on demand and on Hulu! https://t.co/8TkpB4A0HD""",,False,Mon Feb 24 21:35:52 +0000 2020,63,b'1232056572454424577'
470,Twitter Web App,"b'Today, the president unveiled a Middle East ""peace plan"" that was nearly three years in the making and overseen by\xe2\x80\xa6 https://t.co/DBXL0H36Fu'",,False,Tue Jan 28 20:37:13 +0000 2020,232,b'1222257340361183235'
5703,Twitter Web App,"b'The Atlantic contacts all 50 state health departments to reconstruct the number the CDC is hiding, and finds that 1\xe2\x80\xa6 https://t.co/36UslxRHo5'",,False,Fri Mar 06 16:56:21 +0000 2020,3352,b'1235972496991666179'
2589,Twitter for iPhone,b'64-year-old becomes oldest woman to row across Atlantic Ocean  #InternationalWomensDay  https://t.co/9SoGZNdO5A',,False,Sun Mar 08 17:02:08 +0000 2020,193,b'1236698730700492800'
9074,Twitter for iPad,"b'So, today, we learned our subsised banks - AIB and Bank of Ireland - are selling their ATM networks to an American\xe2\x80\xa6 https://t.co/wMCU6iZ2nu'",,False,Wed Jan 29 00:41:45 +0000 2020,2678,b'1222318879709581313'
76397,Twitter for iPhone,"b'Question for GOP senators: If you don\xe2\x80\x99t want a fair trial, why should anyone think you want a fair election?'",,False,Wed Jan 29 21:14:57 +0000 2020,21071,b'1222629226551050240'
1631,Twitter Web App,"b'A medium length rant incoming: thread, aimed primarily at established touring bands, promoters, booking agents and\xe2\x80\xa6 https://t.co/QaIVxIIaAI'",,False,Sun Mar 08 12:14:38 +0000 2020,392,b'1236626378616954882'
1273,Twitter for iPhone,"b'I have been saying since the protests began that foreign interests are trying to destabilize our country, and block\xe2\x80\xa6 https://t.co/67XsVmOr7e'",,False,Sat Feb 29 01:52:12 +0000 2020,473,b'1233570634455814144'
1966,Twitter for Android,"b'Postponing or canceling any game due to the coronavirus  is a league office decision but the NBA, sources say, has\xe2\x80\xa6 https://t.co/Tt5ywcjoqW'",,False,Sat Mar 07 02:52:54 +0000 2020,550,b'1236122624469557248'
28072,Twitter for iPhone,"b""This man is sitting alone on a park bench - singing Bon Jovi's \xe2\x80\x98Livin\xe2\x80\x99 on a Prayer\xe2\x80\x99 by himself.\n\nUntil the end. Hum\xe2\x80\xa6 https://t.co/sy7ovM1m5i""",,False,Sun Feb 02 21:37:20 +0000 2020,6857,b'1224084410384965632'
1054,Twitter for iPhone,"b'Hi Tara,\nA piece of advice. Alberta physicians and health care workers are walking in to the biggest crisis of most\xe2\x80\xa6 https://t.co/bIUnBp6Cfw'",,False,Thu Mar 12 20:27:55 +0000 2020,240,b'1238200068538130432'
2315,Twitter Web App,"b""The coronavirus thing is tough to message around with nonvulnerable populations because it's hard to strike the per\xe2\x80\xa6 https://t.co/ADfi21K5Db""",,False,Fri Mar 06 20:18:19 +0000 2020,551,b'1236023326394306560'
13956,Twitter for iPhone,b'Happiest of Happy Birthdays to my friend in life and on TV and the best damn Best Man a guy could ask for. Happy Bi\xe2\x80\xa6 https://t.co/V5AvjQ25qb',,False,Sun Feb 02 21:15:10 +0000 2020,654,b'1224078832505958401'
2181,Twitter Web App,"b""What Trump did this weekend per CNN's @kaitlancollins and @Kevinliptakcnn:\n\n- Mar-a-Lago fundraiser.\n- golf with ML\xe2\x80\xa6 https://t.co/aD7LD65gOJ""",,False,Mon Mar 09 14:38:33 +0000 2020,1454,b'1237024983987236865'
1269,Twitter for iPhone,b'I did this once and I\xe2\x80\x99m bored. This is my favorite book. Rt And reply for your birthday page\xf0\x9f\x92\x9c https://t.co/yw2WzKb5IC',,False,Sat Feb 01 23:54:14 +0000 2020,600,b'1223756474632900608'
975,Twitter for Advertisers.,"b""Have you recently cut the cord? We'll be live-streaming all local broadcast matches on the #DCU website free of cos\xe2\x80\xa6 https://t.co/hfkk1vU97W""",,False,Fri Feb 28 22:47:31 +0000 2020,108,b'1233524156202913792'
1971,Twitter Web App,"b'~wipes off sweat~\n\nI compiled a 16-page, living directory of\n- tools anyone can use to host virtual shows/meetups/p\xe2\x80\xa6 https://t.co/dRXadLaTEm'",,False,Fri Mar 13 21:05:16 +0000 2020,1006,b'1238571853167431680'
635,Twitter for iPhone,b'The face of a very very happy lady with over a 2 min 10k PB!\nI ran 42.32 at Chichester today just 6 days from my 55\xe2\x80\xa6 https://t.co/0dSV7Cm7mZ',,False,Sun Feb 02 13:06:56 +0000 2020,7,b'1223955966066069504'
2607,TweetDeck,b'1. A woman who was a senior producer at Fox &amp; Friends when the show interviewed Jerome Corsi to talk about why Obam\xe2\x80\xa6 https://t.co/GnhQ6mbLfp',,False,Wed Jan 29 13:39:03 +0000 2020,2028,b'1222514493261074433'
29973,Twitter Web App,"b""Hi @JoeBiden,\n\nThis is no way to treat an Iowan. He said he'd vote for the Dem in the general b/c he knows how impo\xe2\x80\xa6 https://t.co/Ptu3v4dhJV""",,False,Tue Jan 28 21:35:25 +0000 2020,3939,b'1222271988535705601'
895,Twitter for iPhone,b'PD Layla (who\xe2\x80\x99s journey has taken her from Battersea dogs home to licensed operational police dog) completes the \xe2\x80\x9cs\xe2\x80\xa6 https://t.co/D5JlzPjjx7',,False,Thu Jan 30 16:18:13 +0000 2020,40,b'1222916936444542976'
